{
  "schema_version": 1,
  "id": "framework-ranking-v1",
  "simulation_id": "simulation-correctness-fixture",
  "dataset_id": "support-cases-v1",
  "treatment_ids": [
    "baseline-v1",
    "candidate-a-v1",
    "candidate-b-v1"
  ],
  "metric_ids": [
    "task-success-v1"
  ],
  "simulated_scores_file": "evals/calibrations/fixtures/framework-ranking.simulated.json",
  "reference_scores_file": "evals/calibrations/fixtures/framework-ranking.reference.json",
  "reference": {
    "kind": "framework-fixture",
    "label_digest": "eeeeeeeeeeeeeeeeeeeeeeeeeeeeeeeeeeeeeeeeeeeeeeeeeeeeeeeeeeeeeeee",
    "reference_window_end": "2026-07-30T00:00:00Z",
    "reviewer_identity": "framework-fixture-reviewer"
  },
  "thresholds": {
    "minimum_samples": 3,
    "minimum_rank_correlation": 0.9,
    "minimum_linear_correlation": 0.9,
    "minimum_human_agreement": 0.8
  },
  "required_slices": [
    "standard",
    "risk"
  ],
  "staleness_days": 365,
  "framework_fixture": true
}
